{
  "coordinates": [18.875591, 42.293835],
  "verified": true,
  "name": {
    "en": "TODO",
    "hbs": "Stari mlin Ivanovići",
    "ru": "TODO"
  },
  "description": {
    "en": "TODO",
    "hbs": "TODO",
    "ru": "разрушенная мельница"
  },
  "article": {
    "en": ["TODO"],
    "hbs": ["TODO"],
    "ru": ["TODO"]
  },
  "photos": [
    {
      "filename": "TODO"
    }
  ],
  "sources": []
}
