{
  "coordinates": [18.897481, 42.262385],
  "verified": true,
  "name": {
    "en": "TODO",
    "hbs": "Manastir Praskvica",
    "ru": "TODO"
  },
  "description": {
    "en": "TODO",
    "hbs": "TODO",
    "ru": "древний монастырь"
  },
  "article": {
    "en": ["TODO"],
    "hbs": ["TODO"],
    "ru": ["TODO"]
  },
  "photos": [
    {
      "filename": "TODO"
    }
  ],
  "sources": []
}
