{
  "coordinates": [18.7015347, 42.4851907],
  "verified": true,
  "name": {
    "en": "TODO",
    "hbs": "Palača Balović",
    "ru": "TODO"
  },
  "description": {
    "en": "TODO",
    "hbs": "TODO",
    "ru": "дворец XVIII в."
  },
  "article": {
    "en": ["TODO"],
    "hbs": ["TODO"],
    "ru": ["TODO"]
  },
  "photos": [
    {
      "filename": "TODO"
    }
  ],
  "sources": []
}
