{
  "coordinates": [18.690072, 42.473284],
  "verified": false,
  "name": {
    "en": "TODO",
    "hbs": "Tvrđava Bijeli Pjesak",
    "ru": "TODO"
  },
  "description": {
    "en": "TODO",
    "hbs": "TODO",
    "ru": "австро-венгерский форт"
  },
  "article": {
    "en": ["TODO"],
    "hbs": ["TODO"],
    "ru": ["TODO"]
  },
  "photos": [
    {
      "filename": "TODO"
    }
  ],
  "sources": []
}
