{
  "coordinates": [19.232471, 42.403937],
  "verified": false,
  "name": {
    "en": "TODO",
    "hbs": "Manastir Dajbabe",
    "ru": "TODO"
  },
  "description": {
    "en": "TODO",
    "hbs": "TODO",
    "ru": "монастырь в катакомбах"
  },
  "article": {
    "en": ["TODO"],
    "hbs": ["TODO"],
    "ru": ["TODO"]
  },
  "photos": [
    {
      "filename": "TODO"
    }
  ],
  "sources": []
}
